{
  "version": 1,
  "agent": "critic",
  "goal": "G-1",
  "slice": "S-4",
  "attempt": 1,
  "round": 1,
  "diffHash": "1fa4eab484d9822f",
  "verdict": "pass",
  "summary": "Criterion C-7 (page at / shows 'N notes' where N is the store size) is met by the change. public/index.html no longer hardcodes a count; it fetches /api/notes and writes notes.length + ' notes'. src/server.mjs exports startServer(store, port) so the test can inject a store. npm test passes 6 of 6, including the new /api/notes and page test. The browser render of the inline script was not executed; C-7 is verified from the code path and the test's static HTML checks. The slice is recorded as S-4 as requested; plan.json lists the note-count work under S-3 and commit 86da41a is tagged [S-3], so the id mismatch is the caller's to reconcile.",
  "findings": [
    {
      "id": "F-1",
      "severity": "minor",
      "file": "tests/server.test.mjs",
      "line": 20,
      "issue": "The new test checks the page only statically (no hardcoded '0 notes' and the presence of '/api/notes'). It does not execute the inline script, so nothing in the suite confirms that the DOM text becomes 'N notes' after the fetch resolves. The C-7 behavior rests on reading the script in public/index.html.",
      "suggestion": "Optionally add a DOM-level check (for example a jsdom or browser run) that the count element reads 'N notes' for a store of N notes.",
      "authority": "criterion:C-7",
      "evidence": [
        { "type": "file", "path": "tests/server.test.mjs", "line": 20, "quote": "assert.ok(!/>\\s*0 notes\\s*</.test(html));" },
        { "type": "file", "path": "public/index.html", "line": 10, "quote": "textContent = notes.length + \" notes\";" }
      ]
    },
    {
      "id": "F-2",
      "severity": "note",
      "file": "src/server.mjs",
      "line": 19,
      "issue": "The main-module block now seeds the store from LANTERN_SEED. This is a development convenience outside C-7. It does not change the page contract and only runs when the file is the entry point.",
      "suggestion": "Consider noting LANTERN_SEED in the README, or dropping it if it is not needed for this slice.",
      "authority": "criterion:C-7",
      "evidence": [
        { "type": "diff", "path": "src/server.mjs", "quote": "for (let i = 1; i <= Number(process.env.LANTERN_SEED ?? 0); i++) createNote(store, { title: `Sample ${i}` });" }
      ]
    }
  ],
  "criteria": [
    {
      "id": "C-7",
      "status": "met",
      "evidence": [
        { "type": "diff", "path": "public/index.html", "quote": "-  <p id=\"count\">0 notes</p>  /  +  <p id=\"count\">Loading notes…</p>" },
        { "type": "file", "path": "public/index.html", "line": 10, "quote": "textContent = notes.length + \" notes\";" },
        { "type": "file", "path": "src/server.mjs", "quote": "if (req.url === \"/api/notes\") { ... res.end(JSON.stringify(listNotes(store))); }" },
        { "type": "test", "path": "tests/server.test.mjs", "quote": "npm test (node --test \"tests/**/*.test.mjs\"): tests 6, pass 6, fail 0" }
      ],
      "note": "The page fetches /api/notes, which returns listNotes(store) for the injected store, and writes the length followed by ' notes'. The count is therefore the store size. The browser render was not run."
    }
  ],
  "writtenAt": "2026-10-14T14:36:28Z"
}
