{
  "version": 1,
  "agent": "critic",
  "goal": "G-1",
  "slice": "S-2",
  "attempt": 1,
  "round": 1,
  "diffHash": "08419144b57e627c",
  "verdict": "pass",
  "summary": "S-2 meets C-6. The slice adds src/export.mjs and tests/export.test.mjs, both listed in the S-2 paths, and touches nothing else. exportMarkdown(store) maps each note to '## <title>', a blank line, the body, and a trailing newline, then joins the sections with a newline. That gives one ## section per note in store order with the body below its heading, as C-6 and the change spec requirement 'Export to markdown' require. An empty store returns an empty string. npm test ran 7 tests (2 for export, 5 for notes): 7 pass, 0 fail, exit 0. No secrets, no non-English prose, no block or major findings. One note on the raw body emission. The working tree shows the two files as untracked, so the diff hash covers them and the evidence was read from the working tree.",
  "findings": [
    {
      "id": "F-1",
      "severity": "note",
      "file": "src/export.mjs",
      "line": 2,
      "issue": "Bodies are emitted verbatim. A body that contains a line starting with '## ' would look like an extra section to a naive reader of the output. The criterion and spec do not ask for escaping, so this is informational only.",
      "suggestion": "Optional: leave as is for v0.2. Revisit if exported markdown is parsed back into notes.",
      "authority": "criterion:C-6",
      "evidence": [
        { "type": "file", "path": "src/export.mjs", "line": 2, "quote": "return store.map((n) => `## ${n.title}\\n\\n${n.body}\\n`).join(\"\\n\");" }
      ],
      "preExisting": false,
      "disputed": false
    }
  ],
  "criteria": [
    {
      "id": "C-6",
      "status": "met",
      "evidence": [
        { "type": "file", "path": "src/export.mjs", "line": 2, "quote": "return store.map((n) => `## ${n.title}\\n\\n${n.body}\\n`).join(\"\\n\");" },
        { "type": "file", "path": "openspec/changes/lantern-v0-2/specs/notes/spec.md", "quote": "The library SHALL export the store as markdown with one `## <title>` section per note followed by its body." },
        { "type": "test", "path": "tests/export.test.mjs", "line": 5, "quote": "exportMarkdown writes one ## section per note in store order" },
        { "type": "test", "path": "tests/export.test.mjs", "line": 17, "quote": "exportMarkdown of an empty store is an empty string" },
        { "type": "command", "quote": "npm test: tests 7, pass 7, fail 0, exit 0" }
      ],
      "note": "Output for two notes is '## First\\n\\nalpha body\\n\\n## Second\\n\\nbeta body\\n'. The test asserts two '## ' headings, store order, and body text below each heading."
    }
  ],
  "model": "claude-haiku-5-5",
  "writtenAt": "2026-10-14T05:21:19Z"
}
