{
  "version": 1,
  "agent": "reviewer",
  "goal": "G-1",
  "slice": "S-3",
  "attempt": 1,
  "round": 1,
  "diffHash": "73d0a1aac249fb01",
  "verdict": "pass",
  "summary": "C-7 is met. The page at / shows '0 notes' in the browser, and /api/notes returns the store contents via listNotes. The diff stays within the declared paths (public/index.html, src/server.mjs). No block findings. The server store is never written to, so the count is always 0, and the page's initial HTML already says '0 notes', so the browser check cannot distinguish the dynamic count from the static text.",
  "findings": [
    {
      "id": "F-1",
      "severity": "major",
      "file": "/private/tmp/claude-501/-Users-jmarron-Developer-personal/6f536223-e803-4e47-b49c-3f5d7ded0fb5/scratchpad/run-2/src/server.mjs",
      "line": 7,
      "issue": "The module-level store is an empty array with no write path, so the count is always 0 and the fetch-driven update is never exercised with N > 0. Also the static HTML already contains '0 notes', so the live check shows no difference between the dynamic path and the placeholder.",
      "suggestion": "Confirm empty-store scope is intended, or add a write path/test that seeds the store and asserts the count.",
      "authority": "criterion:C-7",
      "evidence": [{"type": "file", "path": "/private/tmp/claude-501/-Users-jmarron-Developer-personal/6f536223-e803-4e47-b49c-3f5d7ded0fb5/scratchpad/run-2/src/server.mjs", "line": 7, "quote": "const store = [];"}]
    },
    {
      "id": "F-2",
      "severity": "minor",
      "file": "/private/tmp/claude-501/-Users-jmarron-Developer-personal/6f536223-e803-4e47-b49c-3f5d7ded0fb5/scratchpad/run-2/public/index.html",
      "line": 8,
      "issue": "The fetch has no catch, and no pluralization ('1 notes'). The latter matches the spec text literally; on fetch failure the stale static '0 notes' remains.",
      "suggestion": "Optionally add error handling.",
      "authority": "criterion:C-7",
      "evidence": [{"type": "file", "path": "/private/tmp/claude-501/-Users-jmarron-Developer-personal/6f536223-e803-4e47-b49c-3f5d7ded0fb5/scratchpad/run-2/public/index.html", "line": 8, "quote": "fetch(\"/api/notes\")"}]
    }
  ],
  "criteria": [
    {
      "id": "C-7",
      "status": "met",
      "evidence": [
        {"type": "screenshot", "path": "/private/tmp/claude-501/-Users-jmarron-Developer-personal/6f536223-e803-4e47-b49c-3f5d7ded0fb5/scratchpad/run-2/.harness/evidence/S-3/count.jpg", "host": "localhost:4173", "capturedAt": "2026-10-14T14:40:00Z"},
        {"type": "command", "quote": "curl http://localhost:4173/api/notes returned [] (store size 0), matching the displayed '0 notes'"}
      ],
      "note": "Page displays 'N notes' with N equal to the store size (0)."
    }
  ],
  "browser": {"used": true, "host": "localhost:4173", "note": "Opened own tab on the freshly started dev server, screenshot taken, tab closed, server stopped."},
  "writtenAt": "2026-10-14T14:40:00Z"
}
