{
  "version": 1,
  "agent": "critic",
  "goal": "G-3",
  "slice": "S-1",
  "attempt": 4,
  "round": 1,
  "diffHash": "7a524c31f13486ce",
  "verdict": "pass",
  "summary": "All five criteria are met. npm test passes 120 of 120 (the new tests/bash-prose.test.mjs passes 13 of 13 on its own), and npm run check passes (syntax ok, openspec validate 11 of 11). Cat and tee heredocs that only write a file are dropped from the judged text, heredocs fed to a shell or interpreter stay scanned, the push deny pattern and push rule are confined to one line, the five test cases exist, and docs/rules.md has the row. One major behavior risk remains: a body that writes a denied command to a file is allowed in its own call, and a later call that runs that file (bash run.sh) is also allowed, because the file's contents are never judged across calls. This is the trade-off the goal accepts, so it does not block, but the rules row does not state the cross-call limit.",
  "findings": [
    {
      "id": "F-1",
      "severity": "major",
      "file": "/Users/jmarron/Developer/personal/handoff-harness/scripts/lib/guards/git-guard.mjs",
      "line": 71,
      "issue": "A cat or tee heredoc body that writes a denied command to a file is allowed in its own call, and a later call that runs the file is also allowed, so the deny patterns never see the command that runs.",
      "suggestion": "State the cross-call limit in the docs/rules.md row, or judge a later bash invocation of a file that a heredoc wrote in the same session.",
      "authority": "criterion:C-1",
      "evidence": [
        {
          "type": "command",
          "path": "/Users/jmarron/Developer/personal/handoff-harness/scripts/lib/guards/git-guard.mjs",
          "quote": "checkBashCommand(\"cat > run.sh <<'EOF'\\n<git reset --hard>\\nEOF\") returned allowed, dropFileHeredocs left only \"cat > run.sh <<'EOF'\\nEOF\"; checkBashCommand(\"bash run.sh\") returned allowed"
        }
      ]
    }
  ],
  "criteria": [
    {
      "id": "C-1",
      "status": "met",
      "evidence": [
        {
          "type": "test",
          "path": "/Users/jmarron/Developer/personal/handoff-harness/tests/bash-prose.test.mjs",
          "line": 19,
          "quote": "a cat heredoc that only writes a file is prose, not a command line"
        },
        {
          "type": "test",
          "path": "/Users/jmarron/Developer/personal/handoff-harness/tests/bash-prose.test.mjs",
          "line": 34,
          "quote": "a tee heredoc that names a file is prose, not a command line"
        }
      ]
    },
    {
      "id": "C-2",
      "status": "met",
      "evidence": [
        {
          "type": "test",
          "path": "/Users/jmarron/Developer/personal/handoff-harness/tests/bash-prose.test.mjs",
          "line": 70,
          "quote": "a heredoc fed to a shell is still scanned in full"
        },
        {
          "type": "test",
          "path": "/Users/jmarron/Developer/personal/handoff-harness/tests/bash-prose.test.mjs",
          "line": 79,
          "quote": "a heredoc fed to an interpreter is still scanned in full"
        }
      ]
    },
    {
      "id": "C-3",
      "status": "met",
      "evidence": [
        {
          "type": "test",
          "path": "/Users/jmarron/Developer/personal/handoff-harness/tests/bash-prose.test.mjs",
          "line": 157,
          "quote": "the push rule and the push deny pattern match within one line"
        },
        {
          "type": "command",
          "path": "/Users/jmarron/Developer/personal/handoff-harness/profiles/default.json",
          "quote": "checkBashCommand(\"git push origin goal/G-3\\nfix: keep\") returned allowed; the deny pattern now uses [ \\t]+ and excludes \\n"
        }
      ]
    },
    {
      "id": "C-4",
      "status": "met",
      "evidence": [
        {
          "type": "test",
          "path": "/Users/jmarron/Developer/personal/handoff-harness/tests/bash-prose.test.mjs",
          "line": 19,
          "quote": "cat heredoc case (line 19), tee heredoc case (line 34), shell case (line 70), interpreter case (line 79), push followed by prose on another line (line 157)"
        }
      ]
    },
    {
      "id": "C-5",
      "status": "met",
      "evidence": [
        {
          "type": "command",
          "path": "/Users/jmarron/Developer/personal/handoff-harness/docs/rules.md",
          "line": 14,
          "quote": "grep -n \"The Bash guard judges command lines, not prose\" docs/rules.md returned 14:| The Bash guard judges command lines, not prose: the body of a heredoc that `cat` (with a stdout redirect) or `tee`"
        }
      ]
    }
  ],
  "writtenAt": "2026-10-16T15:04:23.152Z"
}
