{
  "version": 1,
  "agent": "critic",
  "goal": "G-1",
  "slice": "S-3",
  "attempt": 1,
  "round": 1,
  "diffHash": "93603899f2dbdc77",
  "verdict": "pass",
  "summary": "S-3 meets C-7. src/server.mjs now exports createApp(store), which replaces the '0 notes' placeholder in public/index.html with store.length followed by ' notes' for GET /. The new tests/server.test.mjs (untracked) asserts '0 notes' for an empty store and '3 notes' for a store of three created notes, both through the real HTTP handler. npm test ran 9 tests: 9 pass, 0 fail, exit 0. The slice touches only paths listed for S-3 (src/server.mjs, tests/server.test.mjs); public/ is unchanged and the existing placeholder already matches. One major finding: the standalone entry point always serves createApp([]), so the running page (npm start, the fixture devServer) can only ever show '0 notes'. The criterion is met as written because N is the store length, but the count is not observable end to end on the running server. No block findings.",
  "findings": [
    {
      "id": "F-1",
      "severity": "major",
      "file": "src/server.mjs",
      "line": 21,
      "issue": "The standalone entry point starts the server with createApp([]), a fresh empty array that nothing else can populate. The live page therefore always shows '0 notes' regardless of how many notes exist in any process, so C-7 is only verified through the test harness and not on the running app. This is a behavior risk for the dev server and any deployed page, not a failure of the literal criterion, which ties N to the store passed in.",
      "suggestion": "Before handoff, decide how the running server gets its store (shared module-level store, or a note of the limitation in the handoff). Not required to satisfy C-7 as written.",
      "authority": "criterion:C-7",
      "evidence": [
        { "type": "file", "path": "src/server.mjs", "line": 21, "quote": "createApp([]).listen(port, () => console.log(`lantern notes on http://localhost:${port}`));" },
        { "type": "command", "quote": "PORT=4199 node src/server.mjs; curl http://127.0.0.1:4199/ -> <p id=\"count\">0 notes</p>" }
      ],
      "preExisting": false,
      "disputed": false
    },
    {
      "id": "F-2",
      "severity": "minor",
      "file": "src/server.mjs",
      "line": 16,
      "issue": "The count text is always '<N> notes', so a store of exactly one note renders '1 notes'. C-7 and the handoff literally ask for 'N notes', so this is met, but the wording is ungrammatical for N=1.",
      "suggestion": "Optional: render '1 note' for a single note if the handoff wording allows it. Keep 'N notes' otherwise.",
      "authority": "criterion:C-7",
      "evidence": [
        { "type": "file", "path": "src/server.mjs", "line": 16, "quote": "res.end(readFileSync(file, \"utf8\").replace(/(<p id=\"count\">)[^<]*(<\\/p>)/, `$1${store.length} notes$2`));" },
        { "type": "file", "path": "handoff/HANDOFF.md", "quote": "C-7: the page at `/` shows \"N notes\" where N is the number of notes in the store." }
      ],
      "preExisting": false,
      "disputed": false
    }
  ],
  "criteria": [
    {
      "id": "C-7",
      "status": "met",
      "evidence": [
        { "type": "file", "path": "src/server.mjs", "line": 16, "quote": "replace(/(<p id=\"count\">)[^<]*(<\\/p>)/, `$1${store.length} notes$2`)" },
        { "type": "file", "path": "public/index.html", "line": 6, "quote": "<p id=\"count\">0 notes</p>" },
        { "type": "test", "path": "tests/server.test.mjs", "line": 17, "quote": "page shows 0 notes for an empty store" },
        { "type": "test", "path": "tests/server.test.mjs", "line": 21, "quote": "page shows the number of notes in the store" },
        { "type": "command", "quote": "npm test: tests 9, pass 9, fail 0, exit 0" }
      ],
      "note": "Met for the store passed to createApp. The running entry point passes an empty store, so the served value is 0 (see F-1). The handoff spec text (handoff/HANDOFF.md I-5, C-7) and tasks.md 3.1 are satisfied at the function level."
    }
  ],
  "model": "claude-haiku-5-5",
  "writtenAt": "2026-10-14T05:23:36Z"
}
