{
  "version": 1,
  "agent": "critic",
  "goal": "G-3",
  "slice": "S-1",
  "attempt": 1,
  "round": 1,
  "diffHash": "6394a9753530dfc6",
  "verdict": "block",
  "summary": "C-1 to C-5 are met by the heredoc stripping, the new tests (9 pass in tests/bash-prose.test.mjs, 116 pass in npm test) and the rules.md row. The verdict is block because the push rule now reads only the first git push in the text and stops at a newline: a second push to the default branch on a later line is allowed, which breaks the spec's rule that the default branch is never pushed from a session. A second, major finding: a heredoc body that cat or tee writes to a file is dropped even when a later command runs that file.",
  "findings": [
    {
      "id": "F-1",
      "severity": "block",
      "file": "scripts/lib/guards/git-guard.mjs",
      "line": 90,
      "issue": "The push rule matches only the first git push in the text and its argument scan stops at a newline, so a second push to the default branch on a later line is never judged and is allowed.",
      "suggestion": "Judge every git push occurrence (a global match over the same single-line pattern) against the goal branch and the default branch, not only the first.",
      "authority": "spec:openspec/specs/guards/spec.md#no-history-rewrites-and-no-bulk-staging",
      "evidence": [
        {
          "type": "command",
          "path": "scripts/lib/guards/git-guard.mjs",
          "quote": "checkBashCommand(\"git push origin goal/G-3\\ngit push origin main\") => allow; checkBashCommand(\"echo ok\\ngit push origin goal/G-3\\ngit push origin main\") => allow; checkBashCommand(\"git push origin main\") => DENY(git) Blocked: pushing to the default branch main is not allowed from a session."
        },
        {
          "type": "diff",
          "path": "scripts/lib/guards/git-guard.mjs",
          "line": 90,
          "quote": "+    const push = text.match(/git[ \\t]+push\\b([^|;&\\n]*)/);"
        }
      ]
    },
    {
      "id": "F-2",
      "severity": "major",
      "file": "scripts/lib/guards/git-guard.mjs",
      "line": 71,
      "issue": "A heredoc body that cat or tee writes to a file is dropped even when the same or a later command runs that file, so a git reset --hard or a secrets read inside the body runs through bash run.sh; the same text was denied before this diff.",
      "suggestion": "Keep a file-writing heredoc body in the judged text when a later command names the written file as an argument of a shell or interpreter, or ask the human to rule on write-then-run under D-1.",
      "authority": "decision:D-1",
      "evidence": [
        {
          "type": "command",
          "path": "scripts/lib/guards/git-guard.mjs",
          "quote": "cat > run.sh <<'EOF' / git reset --hard / EOF / bash run.sh => allow; cat > run.sh <<'EOF' / git reset --hard / EOF / sh run.sh => allow; tee run.sh <<'EOF' / rm -rf / / EOF / bash run.sh => allow; cat > run.sh <<'EOF' / cat <secrets path> / EOF / bash run.sh => allow"
        },
        {
          "type": "test",
          "path": "tests/bash-prose.test.mjs",
          "line": 221,
          "quote": "the file is written, not run here"
        }
      ]
    }
  ],
  "criteria": [
    {
      "id": "C-1",
      "status": "met",
      "evidence": [
        {
          "type": "test",
          "path": "tests/bash-prose.test.mjs",
          "line": 174,
          "quote": "a cat heredoc that only writes a file is prose, not a command line"
        },
        {
          "type": "command",
          "path": "tests/bash-prose.test.mjs",
          "quote": "node --test tests/bash-prose.test.mjs: ℹ tests 9 / ℹ pass 9 / ℹ fail 0"
        }
      ]
    },
    {
      "id": "C-2",
      "status": "met",
      "evidence": [
        {
          "type": "test",
          "path": "tests/bash-prose.test.mjs",
          "line": 202,
          "quote": "a heredoc fed to a shell is still scanned in full"
        },
        {
          "type": "command",
          "path": "tests/bash-prose.test.mjs",
          "quote": "node --test tests/bash-prose.test.mjs: ℹ pass 9 / ℹ fail 0"
        }
      ]
    },
    {
      "id": "C-3",
      "status": "met",
      "evidence": [
        {
          "type": "test",
          "path": "tests/bash-prose.test.mjs",
          "line": 240,
          "quote": "the push rule and the push deny pattern match within one line"
        },
        {
          "type": "diff",
          "path": "profiles/default.json",
          "line": 80,
          "quote": "\"git[ \\\\t]+push\\\\b[^|;&\\\\n]*(--force|-f\\\\b|...)"
        }
      ]
    },
    {
      "id": "C-4",
      "status": "met",
      "evidence": [
        {
          "type": "test",
          "path": "tests/bash-prose.test.mjs",
          "line": 174,
          "quote": "tests cover a cat heredoc (174), a tee heredoc (186), a heredoc fed to a shell (202), a heredoc fed to an interpreter (211), and a push followed by prose on another line (240)"
        },
        {
          "type": "command",
          "path": "tests/bash-prose.test.mjs",
          "quote": "node --test tests/bash-prose.test.mjs: ℹ pass 9 / ℹ fail 0"
        }
      ]
    },
    {
      "id": "C-5",
      "status": "met",
      "evidence": [
        {
          "type": "command",
          "path": "docs/rules.md",
          "line": 14,
          "quote": "grep -n \"judges command lines, not prose\" docs/rules.md => 14:| The Bash guard judges command lines, not prose: the body of a heredoc that `cat` (with a redirect) or `tee` (with a file) only writes to a file is left out"
        },
        {
          "type": "file",
          "path": "docs/rules.md",
          "line": 14,
          "quote": "A note that mentioned a forced push or a secrets path was denied as if it were run"
        }
      ]
    }
  ],
  "writtenAt": "2026-10-15T19:22:55.096Z"
}
