{
  "version": 1,
  "agent": "critic",
  "goal": "G-1",
  "slice": "S-1",
  "attempt": 1,
  "round": 1,
  "diffHash": "d1adc8f132f78c07",
  "verdict": "pass",
  "summary": "S-1 meets C-1 through C-5. The diff touches only src/notes.mjs and tests/notes.test.mjs, both in the slice paths. createNote is unchanged: it rejects a blank title (C-1) and assigns id, trimmed title, body, tags and createdAt (C-2, now covered by a new test). listNotes sorts by createdAt descending with an id tie-break (C-3), builds its result with filter before sort so the store is never returned or reordered (C-4), and filters by tag case-insensitively when { tag } is given (C-5). npm test ran 5 tests: 5 pass, 0 fail. No secrets, no non-English prose, no block or major findings. One note on the locale-sensitive localeCompare sort key.",
  "findings": [
    {
      "id": "F-1",
      "severity": "note",
      "file": "src/notes.mjs",
      "line": 13,
      "issue": "The sort compares ISO createdAt strings with localeCompare, which depends on the runtime locale and collation. For the uniform ISO format createNote writes, a plain string comparison gives the same order and does not depend on locale.",
      "suggestion": "Optional: replace b.createdAt.localeCompare(a.createdAt) with a plain comparison. Not required for C-3 as written.",
      "authority": "criterion:C-3",
      "evidence": [
        { "type": "file", "path": "src/notes.mjs", "line": 13, "quote": ".sort((a, b) => b.createdAt.localeCompare(a.createdAt) || b.id - a.id);" },
        { "type": "test", "path": "tests/notes.test.mjs", "line": 26 },
        { "type": "command", "quote": "npm test: tests 5, pass 5, fail 0" }
      ],
      "preExisting": false,
      "disputed": false
    }
  ],
  "criteria": [
    {
      "id": "C-1",
      "status": "met",
      "evidence": [
        { "type": "file", "path": "src/notes.mjs", "line": 3, "quote": "if (!title || !title.trim()) throw new Error(\"title is required\");" },
        { "type": "test", "path": "tests/notes.test.mjs", "line": 5 }
      ],
      "note": "createNote is not changed by the diff. Test 'createNote requires a title' passes."
    },
    {
      "id": "C-2",
      "status": "met",
      "evidence": [
        { "type": "file", "path": "src/notes.mjs", "line": 4 },
        { "type": "test", "path": "tests/notes.test.mjs", "line": 17 }
      ],
      "note": "New test asserts id, trimmed title, body, tags and a parseable createdAt. Passes."
    },
    {
      "id": "C-3",
      "status": "met",
      "evidence": [
        { "type": "file", "path": "src/notes.mjs", "line": 13 },
        { "type": "test", "path": "tests/notes.test.mjs", "line": 26 }
      ],
      "note": "Sorted by createdAt descending, tie-break by id descending. The test 'listNotes returns newest first' passes and also checks that the input store keeps its order."
    },
    {
      "id": "C-4",
      "status": "met",
      "evidence": [
        { "type": "file", "path": "src/notes.mjs", "line": 11, "quote": "return store" },
        { "type": "test", "path": "tests/notes.test.mjs", "line": 9 }
      ],
      "note": "filter always creates a new array before sort runs, so the returned value is never the store. Test 'listNotes returns a copy' passes."
    },
    {
      "id": "C-5",
      "status": "met",
      "evidence": [
        { "type": "file", "path": "src/notes.mjs", "line": 12, "quote": ".filter((n) => wanted === undefined || n.tags.some((t) => t.toLowerCase() === wanted))" },
        { "type": "test", "path": "tests/notes.test.mjs", "line": 35 }
      ],
      "note": "Both sides are lowercased. The test covers stored tags 'Work', 'work' and 'WORK', queries 'work' and 'Work', and a non-matching tag that returns an empty list."
    }
  ],
  "model": "claude-haiku-5-5",
  "writtenAt": "2026-10-14T05:19:36Z"
}
